{
  "schemaVersion": "1.0.0",
  "deploymentId": "INTENTMESH_SEPOLIA_SYNTHETIC_V1",
  "profileId": "PUBLIC_TESTNET_DEMO_V1",
  "status": "CONFIRMED_NOT_FINALIZED",
  "chain": {
    "chainId": "eip155:11155111",
    "genesisBlockHash": "0x25a5cc106eea7138acab33231d7160d69cb777ee0c2c553fcddf5138993e6dd9"
  },
  "buildEvidenceHash": "0xebf5f237ff734e5457d57571042d9a2473d31ec8da9408837d85f2507e485d99",
  "deployer": "eip155:11155111:0x2c2807a946e5ae7ef32faf667215362d473318f0",
  "startingNonce": "0",
  "transactions": [
    {
      "sequence": 1,
      "purpose": "DEPLOY_LOCAL_TOKEN",
      "transactionHash": "0x64de2cec81002e1ddcfb381d8115cfe05428c18704cbcd99aeb359db1efbf0e8",
      "nonce": "0",
      "from": "eip155:11155111:0x2c2807a946e5ae7ef32faf667215362d473318f0",
      "to": null,
      "createdContract": "eip155:11155111:0x3466662d1fd8e0bcc5677902fc201d2b9a3ed850",
      "inputHash": "0x24c320a25230101ff56ced47498ed6e61407d96740853afa5522817c71c625e3",
      "nativeValueWei": "0",
      "gasLimit": "444073",
      "maxFeePerGasWei": "9000000000",
      "gasUsed": "403703",
      "effectiveGasPriceWei": "2988584827",
      "actualGasCostWei": "1206500660414381",
      "blockNumber": "11640430",
      "blockHash": "0xd60cf62ed887f541905785295a5ce2def21540d982b78038dfbef370e92a4045",
      "status": "SUCCESS",
      "explorerUrl": "https://sepolia.etherscan.io/tx/0x64de2cec81002e1ddcfb381d8115cfe05428c18704cbcd99aeb359db1efbf0e8"
    },
    {
      "sequence": 2,
      "purpose": "DEPLOY_ALPHA_VAULT",
      "transactionHash": "0x731af182ec3e9b5d973ed02adbbd28368623aa5388f5989245d81d326d032a29",
      "nonce": "1",
      "from": "eip155:11155111:0x2c2807a946e5ae7ef32faf667215362d473318f0",
      "to": null,
      "createdContract": "eip155:11155111:0x229bc017c5dd2bac500154610d14b6bf8b367d61",
      "inputHash": "0x884f9c064ce669cafd18f5b05b2f3ee37242d90d910375e9a8c7241c3883c8ae",
      "nativeValueWei": "0",
      "gasLimit": "482332",
      "maxFeePerGasWei": "9000000000",
      "gasUsed": "438484",
      "effectiveGasPriceWei": "3112138784",
      "actualGasCostWei": "1364623062563456",
      "blockNumber": "11640431",
      "blockHash": "0x3bd721dd914d3705d032a5e69173554496cbb86d2d8db6c97a156b03e8ec8ee6",
      "status": "SUCCESS",
      "explorerUrl": "https://sepolia.etherscan.io/tx/0x731af182ec3e9b5d973ed02adbbd28368623aa5388f5989245d81d326d032a29"
    },
    {
      "sequence": 3,
      "purpose": "DEPLOY_BETA_VAULT",
      "transactionHash": "0xaec98343459290756a58962bf071a47b139586967f0b23979bc4c31deeec25ee",
      "nonce": "2",
      "from": "eip155:11155111:0x2c2807a946e5ae7ef32faf667215362d473318f0",
      "to": null,
      "createdContract": "eip155:11155111:0x70c262a13e645abf0c878741b6c387bfb072cd6e",
      "inputHash": "0xed521c396550ad055fbd7e3a5e0167638cf96ae28be8a1dd06093481e6ab1bc2",
      "nativeValueWei": "0",
      "gasLimit": "482319",
      "maxFeePerGasWei": "9000000000",
      "gasUsed": "438472",
      "effectiveGasPriceWei": "3041865830",
      "actualGasCostWei": "1333772994211760",
      "blockNumber": "11640432",
      "blockHash": "0xa2ad0580d02eb9dd74d73c4cec82080fcb82db15ac1a65614455007eb67c187e",
      "status": "SUCCESS",
      "explorerUrl": "https://sepolia.etherscan.io/tx/0xaec98343459290756a58962bf071a47b139586967f0b23979bc4c31deeec25ee"
    },
    {
      "sequence": 4,
      "purpose": "DEPLOY_POSITION_TOKEN",
      "transactionHash": "0x954bc2613d8bfdae832fac93290f0f6fc2783d656dce1aa323e74edb4b95bd56",
      "nonce": "3",
      "from": "eip155:11155111:0x2c2807a946e5ae7ef32faf667215362d473318f0",
      "to": null,
      "createdContract": "eip155:11155111:0xfa916c06cdfcb669389855a2234644f8c5776175",
      "inputHash": "0x99fcb6e73a8c7e08a294040fa2bf06e19d19a470053ccb1678003ed125a78241",
      "nativeValueWei": "0",
      "gasLimit": "341390",
      "maxFeePerGasWei": "9000000000",
      "gasUsed": "310355",
      "effectiveGasPriceWei": "2969918266",
      "actualGasCostWei": "921728983444430",
      "blockNumber": "11640433",
      "blockHash": "0x4d22421dc0ad01da7b011644ac1074c719432d21ad349373a32071e7166d191d",
      "status": "SUCCESS",
      "explorerUrl": "https://sepolia.etherscan.io/tx/0x954bc2613d8bfdae832fac93290f0f6fc2783d656dce1aa323e74edb4b95bd56"
    },
    {
      "sequence": 5,
      "purpose": "CONFIGURE_ALPHA_POSITION_TOKEN",
      "transactionHash": "0xca543c59810f0d5f01b8514f1a6f78d18de0fc84f9b433484db9f4469891a2c1",
      "nonce": "4",
      "from": "eip155:11155111:0x2c2807a946e5ae7ef32faf667215362d473318f0",
      "to": "eip155:11155111:0x229bc017c5dd2bac500154610d14b6bf8b367d61",
      "createdContract": null,
      "inputHash": "0x093749405a8675f2b4feb9a5727d72438e7afc41b39abf5a972ecf95d3b7ef82",
      "nativeValueWei": "0",
      "gasLimit": "52966",
      "maxFeePerGasWei": "9000000000",
      "gasUsed": "45319",
      "effectiveGasPriceWei": "3091108458",
      "actualGasCostWei": "140085944208102",
      "blockNumber": "11640434",
      "blockHash": "0x7c48de1dabf9a2f621499f5e42ebc7cda6a9cb03065c0e3f7a4b2148662496aa",
      "status": "SUCCESS",
      "explorerUrl": "https://sepolia.etherscan.io/tx/0xca543c59810f0d5f01b8514f1a6f78d18de0fc84f9b433484db9f4469891a2c1"
    },
    {
      "sequence": 6,
      "purpose": "CONFIGURE_BETA_POSITION_TOKEN",
      "transactionHash": "0x79342228b04c479921a35d30053d42ce914fe49568659381668581795a81ecf3",
      "nonce": "5",
      "from": "eip155:11155111:0x2c2807a946e5ae7ef32faf667215362d473318f0",
      "to": "eip155:11155111:0x70c262a13e645abf0c878741b6c387bfb072cd6e",
      "createdContract": null,
      "inputHash": "0x093749405a8675f2b4feb9a5727d72438e7afc41b39abf5a972ecf95d3b7ef82",
      "nativeValueWei": "0",
      "gasLimit": "52966",
      "maxFeePerGasWei": "9000000000",
      "gasUsed": "45319",
      "effectiveGasPriceWei": "3026983405",
      "actualGasCostWei": "137179860931195",
      "blockNumber": "11640435",
      "blockHash": "0x9dd11ef72c7c03161663a5db52cadbc8871310b4d9049d14c8d79839eb850846",
      "status": "SUCCESS",
      "explorerUrl": "https://sepolia.etherscan.io/tx/0x79342228b04c479921a35d30053d42ce914fe49568659381668581795a81ecf3"
    },
    {
      "sequence": 7,
      "purpose": "AUTHORIZE_ALPHA_VAULT",
      "transactionHash": "0x5710a983f38afcd6368f9d420e0288aa53e7c3bab11132dbf0ff5fa798ebc6f0",
      "nonce": "6",
      "from": "eip155:11155111:0x2c2807a946e5ae7ef32faf667215362d473318f0",
      "to": "eip155:11155111:0xfa916c06cdfcb669389855a2234644f8c5776175",
      "createdContract": null,
      "inputHash": "0xe85d2b0119ce3de047b50454446eadcbcfb440c0f7b3837dc474a959befdc1b1",
      "nativeValueWei": "0",
      "gasLimit": "53383",
      "maxFeePerGasWei": "9000000000",
      "gasUsed": "45676",
      "effectiveGasPriceWei": "2996056964",
      "actualGasCostWei": "136847897887664",
      "blockNumber": "11640436",
      "blockHash": "0x23099dd839abbeb35096ac5506434dba4035a331f3261daed470bf62e7b41b81",
      "status": "SUCCESS",
      "explorerUrl": "https://sepolia.etherscan.io/tx/0x5710a983f38afcd6368f9d420e0288aa53e7c3bab11132dbf0ff5fa798ebc6f0"
    },
    {
      "sequence": 8,
      "purpose": "AUTHORIZE_BETA_VAULT",
      "transactionHash": "0xc8345ab585400af5acb1b65f8e097c8103a9d1556da6609f90b63f8add0d4611",
      "nonce": "7",
      "from": "eip155:11155111:0x2c2807a946e5ae7ef32faf667215362d473318f0",
      "to": "eip155:11155111:0xfa916c06cdfcb669389855a2234644f8c5776175",
      "createdContract": null,
      "inputHash": "0x3f14c550bb305c84365c74ee13f590ef369ab29beaa219362395904bf321153e",
      "nativeValueWei": "0",
      "gasLimit": "53383",
      "maxFeePerGasWei": "9000000000",
      "gasUsed": "45676",
      "effectiveGasPriceWei": "3120512106",
      "actualGasCostWei": "142532510953656",
      "blockNumber": "11640437",
      "blockHash": "0xbec5822b3b9250d3e70af0773b1edbd44d6ec5c699394a54fbfbf174947f8c1f",
      "status": "SUCCESS",
      "explorerUrl": "https://sepolia.etherscan.io/tx/0xc8345ab585400af5acb1b65f8e097c8103a9d1556da6609f90b63f8add0d4611"
    }
  ],
  "contracts": {
    "token": {
      "address": "eip155:11155111:0x3466662d1fd8e0bcc5677902fc201d2b9a3ed850",
      "deploymentTransactionHash": "0x64de2cec81002e1ddcfb381d8115cfe05428c18704cbcd99aeb359db1efbf0e8",
      "runtimeBytecodeKeccak256": "0xe92dffda25f57de9a90d9b456831b7421105ba3ef08468df1c2544a3b6fd9bbc",
      "artifactRuntimeMatch": true
    },
    "alpha": {
      "address": "eip155:11155111:0x229bc017c5dd2bac500154610d14b6bf8b367d61",
      "deploymentTransactionHash": "0x731af182ec3e9b5d973ed02adbbd28368623aa5388f5989245d81d326d032a29",
      "runtimeBytecodeKeccak256": "0x28fbe426daec40137e4ed4ef259de836a5524f5abc8bb8a647c8cb5bc15803e2",
      "artifactRuntimeMatch": true
    },
    "beta": {
      "address": "eip155:11155111:0x70c262a13e645abf0c878741b6c387bfb072cd6e",
      "deploymentTransactionHash": "0xaec98343459290756a58962bf071a47b139586967f0b23979bc4c31deeec25ee",
      "runtimeBytecodeKeccak256": "0x28fbe426daec40137e4ed4ef259de836a5524f5abc8bb8a647c8cb5bc15803e2",
      "artifactRuntimeMatch": true
    },
    "position": {
      "address": "eip155:11155111:0xfa916c06cdfcb669389855a2234644f8c5776175",
      "deploymentTransactionHash": "0x954bc2613d8bfdae832fac93290f0f6fc2783d656dce1aa323e74edb4b95bd56",
      "runtimeBytecodeKeccak256": "0xc1609c0bc05d0b2142542ab8183b752cfce7be6fe147c03a7df222621b77bed6",
      "artifactRuntimeMatch": true
    }
  },
  "configuration": {
    "alphaPositionToken": "eip155:11155111:0xfa916c06cdfcb669389855a2234644f8c5776175",
    "betaPositionToken": "eip155:11155111:0xfa916c06cdfcb669389855a2234644f8c5776175",
    "alphaAuthorized": true,
    "betaAuthorized": true
  },
  "totalWorstCaseGasCostWei": "17665308000000000",
  "manifestHash": "0xf613c05a1de4b311ada7afd2b46c5a30788b430915e898cebdada8b4a9f95252"
}
